{
 "schema_version": "1.0.0",
 "projeto": {
  "nome": "Ocarina of Time DSi",
  "descricao": "Port de The Legend of Zelda: Ocarina of Time para Nintendo DSi, com 3D na tela de cima pelo geometry engine do DS e interface 2D na tela de baixo.",
  "alvo": "TWiLight Menu++ / nds-bootstrap em modo DSi, sem FPU (matemática em ponto fixo no ARM9)",
  "base_de_codigo": "Decompilação zeldaret/oot em C, embutida em game/oot e pinada no commit 14759abf9abb4295de142cdc1452998630ea70fb; adaptações próprias em source/gfx, source/nds, source/ui e source/main.c.",
  "ambiente_medicao_padrao": "melonDS 1.1, modo DS, 67 MHz, janela 272x448, cartão SD emulado pelo DLDI FolderSync. Salvo indicação contrária, toda medida deste arquivo foi feita nesse ambiente.",
  "versionamento": "A árvore de trabalho não tem histórico git utilizável (nenhum commit registrado). Não existe número de versão do port; o identificador estável de cada entrega é o OTD-NNN.",
  "aviso_emulador": "Resultado de emulador não é medição de hardware físico. O portão de DSi real continua aberto para todas as entregas.",
  "codigo_de_terceiros": [
   {
    "nome": "zeldaret/oot",
    "papel": "Decompilação do jogo que fornece código de lógica, tipos, macros F3DEX2 e tabelas; é a base integrada, não código próprio do port.",
    "versao_ou_referencia": "commit 14759abf9abb4295de142cdc1452998630ea70fb (main, 2026-10-18)",
    "licenca": "ver repositório de origem; nenhum asset extraído é redistribuído por este projeto"
   },
   {
    "nome": "devkitARM / libnds / libfat / maxmod / Calico",
    "papel": "Toolchain e bibliotecas de plataforma do DS.",
    "versao_ou_referencia": "devkitARM r68-1 (GCC 16.1.0), libnds 2.0.2, binutils 2.46.0, ndstool 2.3.1, Calico 1.2.0",
    "licenca": "ver pacotes dkp-libs/dkp-windows"
   },
   {
    "nome": "melonDS",
    "papel": "Emulador usado para todas as validações registradas.",
    "versao_ou_referencia": "1.1",
    "licenca": "GPLv3"
   }
  ]
 },
 "estados": {
  "planejado": {
   "rotulo": "Planejado",
   "descricao": "Escopo definido; nenhum código da entrega foi escrito."
  },
  "em_implementacao": {
   "rotulo": "Em implementação",
   "descricao": "Código em andamento; nenhuma medição fechada."
  },
  "implementado": {
   "rotulo": "Implementado",
   "descricao": "Compila e roda, mas não passou por teste registrado na condição real de uso."
  },
  "testado_computador": {
   "rotulo": "Testado no computador",
   "descricao": "Validado por autoteste ou verificação fora do DS (por exemplo, no host)."
  },
  "testado_emulador": {
   "rotulo": "Testado em emulador",
   "descricao": "Validado no melonDS 1.1 em modo DS, com evidência registrada. Não é hardware físico."
  },
  "testado_hardware": {
   "rotulo": "Testado em hardware físico",
   "descricao": "Validado em DSi real via TWiLight Menu++ / nds-bootstrap. Nenhuma entrega chegou aqui."
  },
  "parcial_bloqueado_regressao": {
   "rotulo": "Parcial, bloqueado ou com regressão conhecida",
   "descricao": "Entrega incompleta, impedida por dependência externa ou com defeito conhecido registrado."
  }
 },
 "medicoes_definicoes": [
  {
   "chave": "fps",
   "nome": "FPS exibido",
   "definicao": "Quadros terminados dentro da última janela de 1 segundo do relógio de barramento (BUS_CLOCK), impresso na linha 8 da consola e atualizado no ecrã a 4 Hz.",
   "como_medido": "perfEnd incrementa framesInSec a cada iteração; quando now − secondStart ≥ BUS_CLOCK, fps = framesInSec e a contagem recomeça. Cada iteração termina em swiWaitForVBlank(), então o valor não passa de 60 e é sempre inteiro.",
   "limitacoes": "É um inteiro por janela, não uma média histórica; esconde variação dentro da janela e diferenças abaixo de 1 FPS. É o FPS do loop no emulador, não uma garantia no DSi real."
  },
  {
   "chave": "taxa_simulacao_hz",
   "nome": "Taxa de simulação",
   "definicao": "Ticks de lógica do jogo por segundo, independentes do desenho.",
   "como_medido": "Contador incrementado por IRQ de VBlank e convertido em ticks de 3 quadros (20 Hz); a taxa real é recalculada a cada segundo.",
   "limitacoes": "Mede o escalonador, não o custo de render; um quadro perdido devolve mais de um tick e esconde a queda de FPS."
  },
  {
   "chave": "tempo_quadro_ms",
   "nome": "Tempo de quadro (f)",
   "definicao": "Intervalo entre duas chamadas consecutivas a perfEnd, ou seja a última iteração inteira do loop: entrada, render, texto do HUD, lógica e espera de VBlank.",
   "como_medido": "timeTicks() no fim de cada iteração, subtraído do anterior antes da conversão para microssegundos; impresso como f na linha 8. É a última iteração, não a média.",
   "limitacoes": "É o período do loop, não o tempo de GPU; inclui telemetria, lógica e a espera de VBlank. Não é comparável entre sessões sem um par A/B da mesma rodada. O recorde de f desde o boot é impresso como w: é marca d'água, não o custo atual, e inclui os quadros de carregamento."
  },
  {
   "chave": "tempo_render_ms",
   "nome": "Tempo de render (s)",
   "definicao": "Tempo de CPU entre o início da montagem da cena e a submissão completa da display list ao geometry engine.",
   "como_medido": "Par de leituras do timer de hardware em volta de geDrawList; impresso como s na linha 8.",
   "limitacoes": "Não inclui o rasterizador: o custo de preenchimento de pixel não aparece aqui. É a métrica usada nas comparações A/B de otimização do motor."
  },
  {
   "chave": "tempo_submissao_ms",
   "nome": "Tempo de submissão",
   "definicao": "Parcela do tempo de render gasta em chamadas de envio ao GE (matrizes, vértices, texturas).",
   "como_medido": "Acumulador das chamadas de submissão dentro do render; foi o indicador que expôs a espera de 236 ms por polls de MMIO.",
   "limitacoes": "No emulador, cada acesso a MMIO tem custo diferente do hardware; serve para comparar builds, não para prever o DSi real."
  },
  {
   "chave": "grao",
   "nome": "Grão do painel (métrica própria)",
   "definicao": "Média do módulo da diferença de luminância entre pixels vizinhos horizontais no painel 3D (indicador de ruído de alta frequência). Não é uma medida de cor.",
   "como_medido": "Recorte _topbig (painel 256x192 ampliado 2x) processado por ferramentas/speck2.py: remove a duplicação da ampliação, converte cada pixel para luminância 0,30R+0,59G+0,11B, ignora pares em que ambos os pixels têm luminância abaixo de 8 e devolve a média de |luminância(x)-luminância(x+1)|.",
   "limitacoes": "Só luminância, sem calibração publicada contra referência externa; ignora pares escuros e por isso pode subestimar ruído em áreas escuras. Textura detalhada e borda de geometria também aumentam o número: só é comparável entre capturas do mesmo ângulo, câmera e build."
  },
  {
   "chave": "contagem",
   "nome": "Contagem de eventos",
   "definicao": "Número de ocorrências de um evento instrumentado no HUD (triângulos, binds, uploads, acertos de cache, recusas, despejos).",
   "como_medido": "Contadores incrementados no tradutor e impressos nas linhas 18..22 da consola.",
   "limitacoes": "Contagem não mede tempo; dois contadores que se movem juntos não provam causalidade."
  },
  {
   "chave": "percentual",
   "nome": "Variação percentual",
   "definicao": "Diferença relativa entre duas medições da mesma grandeza, na mesma condição.",
   "como_medido": "Calculada a partir dos valores absolutos registrados; nunca a partir de estimativa.",
   "limitacoes": "Só vale quando build, cena, câmera e instrumentação são equivalentes."
  },
  {
   "chave": "vazao_mb_s",
   "nome": "Vazão de dados",
   "definicao": "Bytes processados por segundo em um caminho de dados (Yaz0, leitura de SD).",
   "como_medido": "Tamanho do blob dividido pelo tempo de relógio de hardware do caminho completo.",
   "limitacoes": "No emulador o tempo de SD não existe; vazão de leitura real só pode ser medida em hardware."
  }
 ],
 "entregas": [
  {
   "id": "OTD-001",
   "tipo": "entrega",
   "titulo": "Sonda de hardware: o DSi emulado entrega DSi mode, RAM e duas telas",
   "data": "2026-10-26",
   "frente": "jogo",
   "fase": "0",
   "estado": "testado_emulador",
   "subestado": "portão de hardware físico bloqueado: nenhum DSi real testado",
   "build": {
    "identificador": "árvore local sem identificador de versão",
    "commit": null,
    "observacao": "O ROM é OcarinaDsi.nds, compilado com devkitARM r68-1 e -Wall -Wextra sem avisos."
   },
   "resumo_publico": "Antes de portar o jogo, o projeto provou que o ambiente do DSi existe: modo DSi, memória, clock, cartão SD e as duas telas. No emulador em modo DS a sonda confirma a base e mede os limites; a confirmação em DSi real segue pendente.",
   "estudo_engenharia": {
    "problema": "Sem saber se o DSi entrega DSi mode, 16 MB de RAM, clock alto, SD e duas telas simultâneas, qualquer decisão de arquitetura seria aposta.",
    "investigacao": "Sonda em source/nds/probe.c lendo SCFG_CLK/SCFG_EXT, heap e um padrão esparso de RAM; benchmark de SD em source/nds/bench.c; base de tempo em timer de hardware porque tickGetCount do Calico não avança nos timers disponíveis.",
    "decisao": "Foi adotado MODE_0_3D no motor principal com grade de 1.024 quads (2.048 triângulos, limite do hardware) e MODE_0_2D no motor secundário com console e sprites; toque por OBJ com hit-test.",
    "resultado": "No melonDS em modo DS: 60 fps com 2.048 triângulos, frame de 16,7 ms, pior quadro 29 ms, submissão de ~0,4 ms, toque acertando a célula (3,3). DSi mode, porém, aparece como NO e SCFG_CLK nega o boost, como esperado em modo DS.",
    "limitacao": "Tudo foi medido em modo DS. Confirmar DSi mode, heap de ~15,9 MB, bit de 134 MHz e SD real exige um DSi físico; sem isso o projeto para."
   },
   "medicoes": [
    {
     "indicador": "fps",
     "valor": 60,
     "unidade": "fps",
     "condicao": {
      "cena": "grade de 1.024 quads",
      "camera": "fixa",
      "build": "sonda inicial",
      "configuracao": "modo DS, 2.048 triângulos"
     },